{
  "schemaVersion": "1.0.0",
  "id": "vatra-central-station-environment",
  "name": "Vatra Central Station",
  "landmarks": [
    {
      "id": "station-terminal",
      "name": "Vatra Central Terminal",
      "type": "station",
      "x": 28,
      "y": 18,
      "width": 92,
      "height": 35,
      "color": "#a7a094"
    },
    {
      "id": "clock-tower",
      "name": "Clock Tower",
      "type": "tower",
      "x": 66,
      "y": 27,
      "width": 16,
      "height": 16,
      "color": "#857f74"
    },
    {
      "id": "platform-one",
      "name": "Platform 1",
      "type": "platform",
      "x": 135,
      "y": 22,
      "width": 285,
      "height": 18,
      "color": "#8d918d"
    },
    {
      "id": "platform-two",
      "name": "Platform 2",
      "type": "platform",
      "x": 135,
      "y": 73,
      "width": 310,
      "height": 18,
      "color": "#7c817e"
    },
    {
      "id": "glass-footbridge",
      "name": "Glass Footbridge",
      "type": "bridge",
      "x": 235,
      "y": 38,
      "width": 22,
      "height": 55,
      "color": "#68808a"
    },
    {
      "id": "freight-platform",
      "name": "Freight Platform",
      "type": "platform",
      "x": 360,
      "y": 115,
      "width": 155,
      "height": 18,
      "color": "#747975"
    },
    {
      "id": "cargo-warehouse",
      "name": "Red Cargo Warehouse",
      "type": "warehouse",
      "x": 420,
      "y": 137,
      "width": 105,
      "height": 30,
      "color": "#6d4039"
    },
    {
      "id": "operations-office",
      "name": "Operations Office",
      "type": "office",
      "x": 104,
      "y": 47,
      "width": 32,
      "height": 24,
      "color": "#89908b"
    },
    {
      "id": "signal-annex",
      "name": "Signal Annex",
      "type": "utility",
      "x": 535,
      "y": 105,
      "width": 30,
      "height": 24,
      "color": "#515b59"
    },
    {
      "id": "maintenance-yard",
      "name": "Maintenance Yard",
      "type": "yard",
      "x": 535,
      "y": 135,
      "width": 55,
      "height": 33,
      "color": "#4c5553"
    }
  ],
  "trees": [
    {
      "x": 18,
      "y": 66
    },
    {
      "x": 35,
      "y": 72
    },
    {
      "x": 52,
      "y": 67
    },
    {
      "x": 70,
      "y": 75
    },
    {
      "x": 92,
      "y": 69
    },
    {
      "x": 112,
      "y": 78
    },
    {
      "x": 558,
      "y": 43
    },
    {
      "x": 580,
      "y": 55
    }
  ],
  "streetFurniture": [
    {
      "type": "car",
      "x": 25,
      "y": 92
    },
    {
      "type": "car",
      "x": 49,
      "y": 96
    },
    {
      "type": "car",
      "x": 74,
      "y": 92
    },
    {
      "type": "bench",
      "x": 170,
      "y": 31
    },
    {
      "type": "bench",
      "x": 290,
      "y": 82
    },
    {
      "type": "maintenance-vehicle",
      "x": 560,
      "y": 151
    },
    {
      "type": "freight-wagon",
      "x": 405,
      "y": 108
    },
    {
      "type": "regional-train",
      "x": 280,
      "y": 60
    }
  ]
}
